{
  "authorizations": {},
  "bill": {
    "account_number": "NWH-2026-0502",
    "due_date": "2026-06-10",
    "facility_name": "Newton-Wellesley Hospital",
    "is_itemized": true,
    "line_items": [
      {
        "billed_amount": 1475.0,
        "billing_entity": "facility",
        "cpt": "70450",
        "date_of_service": "2026-05-02",
        "description": "CT head/brain without contrast",
        "units": 1
      },
      {
        "billed_amount": 725.0,
        "billing_entity": "facility",
        "cpt": "72110",
        "date_of_service": "2026-05-02",
        "description": "X-ray, lumbar spine, 4+ views",
        "units": 1
      },
      {
        "billed_amount": 581.0,
        "billing_entity": "facility",
        "cpt": "96360",
        "date_of_service": "2026-05-02",
        "description": "IV hydration, initial hour",
        "units": 1
      }
    ],
    "nonprofit_status": true,
    "patient_balance": 2781.0,
    "statement_date": "2026-05-11"
  },
  "case_id": "sc06_eob_mismatch",
  "derived_flags": [],
  "entities": [
    {
      "balance": 2781.0,
      "kind": "facility",
      "name": "Newton-Wellesley Hospital"
    }
  ],
  "eob": {
    "claim_number": "THP-2026-40771",
    "denial_codes": [],
    "line_items": [
      {
        "allowed_amount": 112.51,
        "billed_amount": 1475.0,
        "cpt": "70450",
        "date_of_service": "2026-05-02",
        "description": "CT head/brain without contrast",
        "patient_responsibility": 0.0,
        "plan_paid": 112.51,
        "units": 1
      },
      {
        "allowed_amount": 125.01,
        "billed_amount": 725.0,
        "cpt": "72110",
        "date_of_service": "2026-05-02",
        "description": "X-ray, lumbar spine, 4+ views",
        "patient_responsibility": 0.0,
        "plan_paid": 125.01,
        "units": 1
      },
      {
        "allowed_amount": 294.45,
        "billed_amount": 581.0,
        "cpt": "96360",
        "date_of_service": "2026-05-02",
        "description": "IV hydration, initial hour",
        "patient_responsibility": 0.0,
        "plan_paid": 294.45,
        "units": 1
      }
    ],
    "patient_responsibility_total": 0.0
  },
  "financial_profile": {},
  "insurance": {
    "member_id": "TUF-31007",
    "payer_name": "TUFTS HEALTH PLAN [170001]",
    "plan_type": "HB CH TUFTS"
  },
  "patient": {
    "dob": "1994-09-19",
    "legal_name": "Grace Kimura"
  }
}
