{
  "authorizations": {},
  "bill": {
    "account_number": "BWH-2026-0422",
    "due_date": "2026-05-31",
    "facility_name": "Brigham and Women's Hospital",
    "is_itemized": true,
    "line_items": [
      {
        "billed_amount": 1828.0,
        "billing_entity": "facility",
        "cpt": "70450",
        "date_of_service": "2026-04-22",
        "description": "CT head/brain without contrast",
        "units": 1
      },
      {
        "billed_amount": 835.0,
        "billing_entity": "facility",
        "cpt": "72110",
        "date_of_service": "2026-04-22",
        "description": "X-ray, lumbar spine, 4+ views",
        "units": 1
      },
      {
        "billed_amount": 826.0,
        "billing_entity": "facility",
        "cpt": "96360",
        "date_of_service": "2026-04-22",
        "description": "IV hydration, initial hour",
        "units": 1
      }
    ],
    "nonprofit_status": true,
    "patient_balance": 3489.0,
    "statement_date": "2026-05-01"
  },
  "case_id": "sc08_clean_overpriced",
  "derived_flags": [],
  "entities": [
    {
      "balance": 3489.0,
      "kind": "facility",
      "name": "Brigham and Women's Hospital"
    }
  ],
  "eob": {},
  "financial_profile": {},
  "insurance": {
    "member_id": "COE-11228",
    "payer_name": "CENTERS OF EXCELLENCE [1026]",
    "plan_type": "HB AMC MGBHP TRANSPLANT"
  },
  "patient": {
    "dob": "1976-02-27",
    "legal_name": "Aisha Bello"
  }
}
