{
  "authorizations": {},
  "bill": {
    "account_number": "MGH-2026-0327",
    "due_date": "2026-05-05",
    "facility_name": "Massachusetts General Hospital",
    "is_itemized": true,
    "line_items": [
      {
        "billed_amount": 1828.0,
        "billing_entity": "facility",
        "cpt": "70450",
        "date_of_service": "2026-03-27",
        "description": "CT head/brain without contrast",
        "units": 1
      },
      {
        "billed_amount": 826.0,
        "billing_entity": "facility",
        "cpt": "96360",
        "date_of_service": "2026-03-27",
        "description": "IV hydration, initial hour",
        "units": 1
      }
    ],
    "nonprofit_status": true,
    "patient_balance": 1828.0,
    "statement_date": "2026-04-05"
  },
  "case_id": "sc09_denial_driven",
  "derived_flags": [],
  "entities": [
    {
      "balance": 1828.0,
      "kind": "facility",
      "name": "Massachusetts General Hospital"
    }
  ],
  "eob": {
    "claim_number": "CCA-2026-33418",
    "denial_codes": [
      "197"
    ],
    "line_items": [
      {
        "allowed_amount": 1828.0,
        "billed_amount": 1828.0,
        "cpt": "70450",
        "date_of_service": "2026-03-27",
        "description": "CT head/brain without contrast",
        "patient_responsibility": 1828.0,
        "plan_paid": 0.0,
        "units": 1
      },
      {
        "allowed_amount": 508.4,
        "billed_amount": 826.0,
        "cpt": "96360",
        "date_of_service": "2026-03-27",
        "description": "IV hydration, initial hour",
        "patient_responsibility": 0.0,
        "plan_paid": 508.4,
        "units": 1
      }
    ],
    "patient_responsibility_total": 1828.0
  },
  "financial_profile": {},
  "insurance": {
    "member_id": "CCA-90514",
    "payer_name": "COMMONWEALTH CARE ALLIANCE [1007]",
    "plan_type": "HB MGH COMMONWEALTH CARE ALLIANCE"
  },
  "patient": {
    "dob": "1968-08-16",
    "legal_name": "Owen Fletcher"
  }
}
